{
  "employeeId": "EMP001",
  "employeeName": "Rahul Sharma",
  "designation": "Software Engineer",
  "department": "Engineering",
  "dateOfJoining": "2026-08-11",
  "workLocation": "Remote",
  "reportingManager": "Anita Desai",
  "buddyName": "Sneha Iyer",
  "itAssets": [
    "MacBook Pro 14\" (Asset Tag: QR-LAP-0231)",
    "Company email account (rahul.sharma@quickryz.in)",
    "Slack & Google Workspace access",
    "VPN credentials"
  ],
  "letterDate": "2026-08-11"
}
